{
 "buildId": "546dc30e6f22",
 "configFingerprint": "",
 "createdAt": "2026-10-11T23:00:51Z",
 "files": [
  {
   "cacheControl": "public, max-age=31536000, immutable",
   "contentType": "text/javascript; charset=utf-8",
   "path": "assets/app.mjs",
   "sha256": "185e4aa49a7f26b3df2b32c3d5fd7d4d6fa66fd9fea978e028c72c727da8cbfa",
   "size": 15037
  },
  {
   "cacheControl": "public, max-age=31536000, immutable",
   "contentType": "text/javascript; charset=utf-8",
   "path": "assets/basemap.mjs",
   "sha256": "db9431576d707ff2102c8e259218c6c0382a39f0e2e6db19c9d05255f3182f12",
   "size": 5343
  },
  {
   "cacheControl": "public, max-age=31536000, immutable",
   "contentType": "text/javascript; charset=utf-8",
   "path": "assets/controls.mjs",
   "sha256": "712dcdaad6b6090e6b2d69160eca0732dd7860419ed9a9cb7ec051293e915639",
   "size": 20716
  },
  {
   "cacheControl": "public, max-age=31536000, immutable",
   "contentType": "text/javascript; charset=utf-8",
   "path": "assets/diagnostics.mjs",
   "sha256": "34bbd56c3198e55fbdeff151a8c918c5de6a33263e3dd853dd9c0059e171c106",
   "size": 2542
  },
  {
   "cacheControl": "public, max-age=31536000, immutable",
   "contentType": "text/javascript; charset=utf-8",
   "path": "assets/draw.mjs",
   "sha256": "d59450ddf0062994d053375371bb78758cbf4c76addfcbc6daab75c0431c16dd",
   "size": 16814
  },
  {
   "cacheControl": "public, max-age=31536000, immutable",
   "contentType": "text/javascript; charset=utf-8",
   "path": "assets/features.mjs",
   "sha256": "728b87c7d0137e2a183fa3c141ea40f91511d234251f7554246a0b7c70ea3415",
   "size": 1468
  },
  {
   "cacheControl": "public, max-age=31536000, immutable",
   "contentType": "text/javascript; charset=utf-8",
   "path": "assets/filters.mjs",
   "sha256": "6206d28cf8cc7352ef109028fc80711f3896bf915c9b91b341d4c9a075d9f90f",
   "size": 5917
  },
  {
   "cacheControl": "public, max-age=31536000, immutable",
   "contentType": "text/javascript; charset=utf-8",
   "path": "assets/geo.mjs",
   "sha256": "42151bb76a5a67fb3dc50f76b19c5ecc1cfb6da809cc9a491610357be0345908",
   "size": 5833
  },
  {
   "cacheControl": "public, max-age=31536000, immutable",
   "contentType": "text/javascript; charset=utf-8",
   "path": "assets/i18n.mjs",
   "sha256": "df2f09c930e79d0adf474dc532fd91b388c1f9a9648fd9b6dca78adcc2397294",
   "size": 1262
  },
  {
   "cacheControl": "public, max-age=31536000, immutable",
   "contentType": "text/javascript; charset=utf-8",
   "path": "assets/icons.mjs",
   "sha256": "6536a19cc164393b2fbc6e4c1bb0917a12848bff1d5dc35d4acd4d93da50d49f",
   "size": 5434
  },
  {
   "cacheControl": "public, max-age=31536000, immutable",
   "contentType": "text/javascript; charset=utf-8",
   "path": "assets/identify.mjs",
   "sha256": "779e3681bad93de90c6e9e7b0abf8cb442097730469cfe07edede005c7fc2ebb",
   "size": 10643
  },
  {
   "cacheControl": "public, max-age=31536000, immutable",
   "contentType": "text/javascript; charset=utf-8",
   "path": "assets/layer_controls.mjs",
   "sha256": "f308f0181ef160dcd1a87aae5505d42cdcae592e337f461cec28cfc2fd535138",
   "size": 10296
  },
  {
   "cacheControl": "public, max-age=31536000, immutable",
   "contentType": "text/javascript; charset=utf-8",
   "path": "assets/legend.mjs",
   "sha256": "ee2a7d9af5513ed76342a87b294c99ea22e6fefea5fdbbc0b30da56b8dffa143",
   "size": 7574
  },
  {
   "cacheControl": "public, max-age=31536000, immutable",
   "contentType": "application/json; charset=utf-8",
   "path": "assets/locales/en.json",
   "sha256": "8dabc1b52f40c1d4518f4fb596aa304e0784dbde93fefc8ef3e4e2c34dd3d5a8",
   "size": 8596
  },
  {
   "cacheControl": "public, max-age=31536000, immutable",
   "contentType": "application/json; charset=utf-8",
   "path": "assets/locales/hu.json",
   "sha256": "cf466c3988f7446954de421dc3035365524004b7fc7d943277ffbd9ca68bbd56",
   "size": 9636
  },
  {
   "cacheControl": "public, max-age=31536000, immutable",
   "contentType": "text/javascript; charset=utf-8",
   "path": "assets/maplibre-gl-shared.mjs",
   "sha256": "b9e696123f6c6e1c56c59ab1b7d8cf58dfcad46f536250ca9dc06e71c1d778db",
   "size": 517545
  },
  {
   "cacheControl": "public, max-age=31536000, immutable",
   "contentType": "text/javascript; charset=utf-8",
   "path": "assets/maplibre-gl-worker.mjs",
   "sha256": "01ad197aa7f4cec258a890febd71b7515e96309881b036a7095befc01a45296e",
   "size": 19133
  },
  {
   "cacheControl": "public, max-age=31536000, immutable",
   "contentType": "text/css; charset=utf-8",
   "path": "assets/maplibre-gl.css",
   "sha256": "d8617d8421930e3fc6185365400e788c374c1a5d9fbe87999998c0bc14a202d3",
   "size": 83310
  },
  {
   "cacheControl": "public, max-age=31536000, immutable",
   "contentType": "text/javascript; charset=utf-8",
   "path": "assets/maplibre-gl.mjs",
   "sha256": "4c2863fa4d87aea830409775923a7c145600a1e3f1124f7325458397d2dc8ca6",
   "size": 592999
  },
  {
   "cacheControl": "public, max-age=31536000, immutable",
   "contentType": "text/javascript; charset=utf-8",
   "path": "assets/overview.mjs",
   "sha256": "05f1d0e84b90a12a6593ff21af5d258002394b9268826478c557446ea54fc1c6",
   "size": 5782
  },
  {
   "cacheControl": "public, max-age=31536000, immutable",
   "contentType": "text/javascript; charset=utf-8",
   "path": "assets/parcel_report.mjs",
   "sha256": "11490b8cbd5fc9969440269a00c89921f637020aea35b64bc44b599ed50cec62",
   "size": 13091
  },
  {
   "cacheControl": "public, max-age=31536000, immutable",
   "contentType": "text/javascript; charset=utf-8",
   "path": "assets/permalink.mjs",
   "sha256": "ef5aa7d8e7d74ba7be24af1d9dd56c59f35473ef13cd48676ab54ac4e41246d4",
   "size": 6566
  },
  {
   "cacheControl": "public, max-age=31536000, immutable",
   "contentType": "text/javascript; charset=utf-8",
   "path": "assets/print.mjs",
   "sha256": "b29c1e2584e6d85c47d1c013c224ae7c08be15a4eab1cf52b465573e225b9ca5",
   "size": 9756
  },
  {
   "cacheControl": "public, max-age=31536000, immutable",
   "contentType": "text/javascript; charset=utf-8",
   "path": "assets/profile.mjs",
   "sha256": "db8a20f5634f2705cd1f1e70f476928831106429e4b842a20158ea18df9eb0a8",
   "size": 4049
  },
  {
   "cacheControl": "public, max-age=31536000, immutable",
   "contentType": "text/javascript; charset=utf-8",
   "path": "assets/rich_text.mjs",
   "sha256": "c825636db17456553444632eb46c9ef6dc387b05b114e70eb91581a646569fa4",
   "size": 1950
  },
  {
   "cacheControl": "public, max-age=31536000, immutable",
   "contentType": "text/javascript; charset=utf-8",
   "path": "assets/search.mjs",
   "sha256": "638fde73a097ccc09f49617193f5eac51ed8ca4d4d1c569777eceddda3ef0f32",
   "size": 8172
  },
  {
   "cacheControl": "public, max-age=31536000, immutable",
   "contentType": "text/javascript; charset=utf-8",
   "path": "assets/search_core.mjs",
   "sha256": "2ff01872e1cb0c5f85f2a14b489dd224834d0c58e0836bdd861b4b74ea78955b",
   "size": 3307
  },
  {
   "cacheControl": "public, max-age=31536000, immutable",
   "contentType": "text/javascript; charset=utf-8",
   "path": "assets/search_worker.mjs",
   "sha256": "c42d6c9190dff405ff177826b81f068aa1e07a43ac03bae81d3883005fcddaf1",
   "size": 2148
  },
  {
   "cacheControl": "public, max-age=31536000, immutable",
   "contentType": "text/javascript; charset=utf-8",
   "path": "assets/shards.mjs",
   "sha256": "ec33f33e32e5ec9c9938b5e16ab03233e079f52b918b70599f3ec5a72157cb13",
   "size": 1886
  },
  {
   "cacheControl": "public, max-age=31536000, immutable",
   "contentType": "text/javascript; charset=utf-8",
   "path": "assets/snap.mjs",
   "sha256": "360939b8b9e8f82de0c07ce212cb0b6486d18d321621eb12f265e3a14ac80292",
   "size": 5976
  },
  {
   "cacheControl": "public, max-age=31536000, immutable",
   "contentType": "text/javascript; charset=utf-8",
   "path": "assets/state.mjs",
   "sha256": "8b9d8f98504b40a592935a50cf30406ffac9fe2de8ecd7dfe47d128c76940643",
   "size": 7536
  },
  {
   "cacheControl": "public, max-age=31536000, immutable",
   "contentType": "text/javascript; charset=utf-8",
   "path": "assets/streetview.mjs",
   "sha256": "aafea00cac8e645fb1d426f65d5e8b0a1a43ec1661600c0497ffd24036048883",
   "size": 14706
  },
  {
   "cacheControl": "public, max-age=31536000, immutable",
   "contentType": "text/javascript; charset=utf-8",
   "path": "assets/style_control.mjs",
   "sha256": "30e08ea1ddfa2db25874a5ad7e7d139bd0673d65ad366c8bda82143b691e372a",
   "size": 9522
  },
  {
   "cacheControl": "public, max-age=31536000, immutable",
   "contentType": "text/css; charset=utf-8",
   "path": "assets/styles.css",
   "sha256": "816f3ccb769fc06b9411f2715b212ed349e2e19f2fa5faa873ebbf31efd9d477",
   "size": 42850
  },
  {
   "cacheControl": "public, max-age=31536000, immutable",
   "contentType": "text/javascript; charset=utf-8",
   "path": "assets/threed.mjs",
   "sha256": "913eb9f38e762f3dab4cf69c0fadf5037b344f4120e126e6a9f841860635a320",
   "size": 9717
  },
  {
   "cacheControl": "public, max-age=31536000, immutable",
   "contentType": "text/javascript; charset=utf-8",
   "path": "assets/tools.mjs",
   "sha256": "51d174e9b55f6c5f70cfb6c32d4fc74faa9cfd06fb136bce44d5897a8cc8b37c",
   "size": 16408
  },
  {
   "cacheControl": "public, max-age=31536000, immutable",
   "contentType": "text/javascript; charset=utf-8",
   "path": "assets/transport.mjs",
   "sha256": "74fd238bba95ddd174c6df9782c7f2df7610b6b58dac921a7ec84d16b7cba822",
   "size": 7128
  },
  {
   "cacheControl": "public, max-age=31536000, immutable",
   "contentType": "text/javascript; charset=utf-8",
   "path": "assets/vendor/pmtiles.js",
   "sha256": "caf981bc46f6327ee7e65d5dc964d89d38a69f60edca2bd4c5c890c21b554c6c",
   "size": 20229
  },
  {
   "cacheControl": "public, max-age=31536000, immutable",
   "contentType": "text/javascript; charset=utf-8",
   "path": "assets/vendor/proj4.js",
   "sha256": "af7df653d91ea591f33d26fb958990bbd3071b2db644a4edaba441cc9861a474",
   "size": 129733
  },
  {
   "cacheControl": "public, max-age=31536000, immutable",